{
  "$ref": "#/definitions/products",
  "definitions": {
    "products": {
      "type": "object",
      "properties": {
        "name": {
          "type": "string"
        },
        "category": {
          "type": "string"
        },
        "badge": {
          "type": "string"
        },
        "badgeColor": {
          "type": "string",
          "default": "bg-teal-glow text-deep-black"
        },
        "icon": {
          "type": "string",
          "default": "fa-solid fa-bolt"
        },
        "iconColor": {
          "type": "string",
          "default": "text-teal-glow"
        },
        "description": {
          "type": "string"
        },
        "price": {
          "type": "string"
        },
        "featured": {
          "type": "boolean",
          "default": true
        },
        "order": {
          "type": "number",
          "default": 0
        },
        "$schema": {
          "type": "string"
        }
      },
      "required": [
        "name",
        "category",
        "description",
        "price"
      ],
      "additionalProperties": false
    }
  },
  "$schema": "http://json-schema.org/draft-07/schema#"
}